place_id,name,address,lat,lng,type
ChIJi2zHU54ndTER69V0hFseESo,Trường mầm non Quốc tế Saigon Academy,"98 Tô Vĩnh Diện, Linh Chiểu, Thủ Đức, Thành phố Hồ Chí Minh 700000, Vietnam",10.8535144,106.7684001,trường mầm non
ChIJWU_p1ZAhdTERMK0TqTm9XVI,Trường mầm non Thiện Mỹ,"Trường Thạnh, Thủ Đức City, Ho Chi Minh City, Vietnam",10.8404859,106.8258203,trường mầm non
ChIJ-bGKMW0ndTERsfSCwkX2YfE,Trường mầm non Tuệ Đức - Võ Văn Ngân Thủ Đức (Pathway School),"240 Đ. Võ Văn Ngân, Bình Thọ, Thủ Đức, Thành phố Hồ Chí Minh 70000, Vietnam",10.8496457,106.7676803,trường mầm non
ChIJ5eOZln_YdDERUD20l2IEbCU,Trường Mầm Non Vầng Dương,"Đ. Số 4, Linh Xuân, Thủ Đức, Thành phố Hồ Chí Minh, Vietnam",10.8736682,106.7687939,trường mầm non
ChIJI7mRFDUvdTEREBuaISERPvw,City's May 19th Preschool,"94 Nguyễn Đình Chiểu, Đa Kao, Quận 1, Thành phố Hồ Chí Minh, Vietnam",10.7877329,106.6980283,trường mầm non
ChIJtwXbWsYsdTER081eXFOc2oM,Trường Mầm Non Quỳnh Hương,"2 ĐT825, Lê Minh Xuân, Bình Chánh, Thành phố Hồ Chí Minh, Vietnam",10.7722223,106.5488201,trường mầm non
ChIJPcKjG_UtdTERvNVYU91zeK0,Trường Mầm non Song ngữ ROB Kids - Phú Lâm Q6,"Bà Hom/C13/23 Cư Xá Phú Lâm B, Phường 13, Thành phố Hồ Chí Minh, 70000, Vietnam",10.7522304,106.6297257,trường mầm non
ChIJr9XuJoQpdTERnuIkLREUVuM,Trường Mầm Non Mẹ Yêu - Học Viện Ánh Dương,"54/24 Đ. Bạch Đằng, Phường 2, Phú Nhuận, Thành phố Hồ Chí Minh 70840, Vietnam",10.8131945,106.6719889,trường mầm non
ChIJfXytZCQtdTERVgr6lCN_DmY,Trường Mầm non Song ngữ ROB Kids - Bình Trị Đông,"270 Bình Trị Đông, Bình Tân, Thành phố Hồ Chí Minh 70000, Vietnam",10.7717721,106.6094437,trường mầm non
ChIJx1QOZnUtdTERAPR9hwew7cQ,Trường MN Hoa Quỳnh,"1481 Nguyễn Cửu Phú, ấp 1, Bình Chánh, Thành phố Hồ Chí Minh, Vietnam",10.7284693,106.5812536,trường mầm non
ChIJK5p2Rj8tdTERvh4YPeIJJ0w,Trường Mầm Non NOBITA,"226/2 Tân Hòa Đông, Bình Trị Đông, Bình Tân, Thành phố Hồ Chí Minh, Vietnam",10.760993,106.6231553,trường mầm non
ChIJIQMIRyosdTERDpIilNe46ao,Trường Mầm Non Bình Minh,"Đường số 10/114 Cx Rađa, Phường 13, Quận 6, Thành phố Hồ Chí Minh 73118, Vietnam",10.7536683,106.627204,trường mầm non
ChIJe8RIxektdTER78_8fsA86sQ,Mầm non Bảo Lam,"532/1/81, 532/1/42 Khu Y Tế Kỹ Thuật Cao, An Lạc A, Bình Tân, Thành phố Hồ Chí Minh 70000, Vietnam",10.735033,106.610688,trường mầm non
ChIJ12-wHqEtdTERp2FttLfvsTM,Trường Mầm non Bầu Trời Xanh,"PJHF+2QG, Phường 16, Quận 8, Thành phố Hồ Chí Minh, Vietnam",10.7275634,106.6244778,trường mầm non
ChIJSWiOAT8tdTERw271KxPpWi0,Trường Mầm Non Kid's Club Cơ Sở Kinh Dương Vương,"427a Đ. Kinh Dương Vương, An Lạc, Bình Tân, Thành phố Hồ Chí Minh, Vietnam",10.7392795,106.6165454,trường mầm non
ChIJE_lAGVUtdTERHF5S5Rlfyf8,Mầm non Ngôi Nhà Bút Chì - Campus 1,"20 Đường số 24, Phường 11, Quận 6, Thành phố Hồ Chí Minh 700000, Vietnam",10.742488,106.6286275,trường mầm non
ChIJs1B36xwsdTERh4-B0ev0kEM,Trường Mầm Non Họa Mi Nightingale,"117 Đ.Lê Lâm, Phú Thạnh, Tân Phú, Thành phố Hồ Chí Minh, Vietnam",10.7807322,106.6247567,trường mầm non
ChIJJQrcsjstdTERK9xYEg2EABY,Trường Mầm non Quốc tế Small Wonder - Quận 6,"24 Đường số 24, Phường 11, Quận 6, Thành phố Hồ Chí Minh 700000, Vietnam",10.7427304,106.6280639,trường mầm non
ChIJ4cwrCc0tdTERrJ7xUMabC3k,Kindy City,"164 - 166 Đ. Vành Đai Trong, An Lạc A, Bình Tân, Thành phố Hồ Chí Minh 700000, Vietnam",10.747822,106.6154044,trường mầm non
ChIJZ78B5bwtdTER-krv6w8DzGU,Mầm Non ABC,"12D Đường số 36, Phường 10, Quận 6, Thành phố Hồ Chí Minh 747160, Vietnam",10.7383381,106.6293214,trường mầm non
ChIJta1ll4YtdTERXNOxisCddSo,Trường mầm non kids club,"4449 Nguyễn Cửu Phú, Tân Tạo A, Bình Tân, Thành phố Hồ Chí Minh, Vietnam",10.7537977,106.5850097,trường mầm non
ChIJCw2oVgAtdTERmMgDdu9oZdY,Trường mầm non Mặt Trời Bé Con,"454 Đ. Trần Văn Giàu, Bình Trị Đông B, Bình Tân, Thành phố Hồ Chí Minh 71908, Vietnam",10.7522777,106.6067715,trường mầm non
ChIJNxRcBG0sdTERqQI8xrMPRl4,Trường Mầm Non Thảo Vy,"1L Đ. 18B, Bình Hưng Hoà A, Bình Tân, Thành phố Hồ Chí Minh, Vietnam",10.7792517,106.6021126,trường mầm non
ChIJDz7411UsdTERtCOC5p-VPzs,TRƯỜNG MẦM NON VY VY,"1577 TL10, Tân Tạo A, Bình Tân, Thành phố Hồ Chí Minh 700000, Vietnam",10.7580945,106.5809461,trường mầm non
ChIJ-9F7ivgrdTERQABf4SugDtg,Trường Mầm Non Nam Long,"88 Đ. Tân Quý, Tân Quý, Tân Phú, Thành phố Hồ Chí Minh, Vietnam",10.7947033,106.6202782,trường mầm non
ChIJ_fdgKAAtdTERGS3-dJPEs8s,Trường mầm non Ngôi Nhà Trẻ Thơ,"117/80 Hồ Văn Long, Tân Tạo, Bình Tân, Thành phố Hồ Chí Minh, Vietnam",10.7639744,106.5793183,trường mầm non
ChIJ6848l7ktdTERFGgjkI52qg0,Trường mầm non Pencil House - Campus2,"28 Đường số 50, P10, Quận 6, Thành phố Hồ Chí Minh 70000, Vietnam",10.7358068,106.6230169,trường mầm non
ChIJ2-v3XUosdTERpRxgRdPv5EA,Kindergarten Bao Ngoc,"951/19 Đường số 38A, Tân Tạo, Bình Tân, Thành phố Hồ Chí Minh, Vietnam",10.7528726,106.6045813,trường mầm non
ChIJsT6V-vkrdTERWVpRAYr4sFo,Trường Mầm Non Sơn Ca,"481/3 Đ. Tân Kỳ Tân Quý, Tân Quý, Tân Phú, Thành phố Hồ Chí Minh, Vietnam",10.7984929,106.61796,trường mầm non
ChIJQbKWDtQtdTERZWJSpBkMRms,Mầm non Việt Đức - Cơ sở 7,"Phường 16, District 8, Ho Chi Minh City, Vietnam",10.7232022,106.6239014,trường mầm non
ChIJuds0YI8tdTER1fyMtEjj2W8,Mầm Non Sunshine - Ánh Thái Dương(Bình Tân),"633 Đ. Kinh Dương Vương, An Lạc, Bình Tân, Thành phố Hồ Chí Minh 008428, Vietnam",10.7304665,106.6118122,trường mầm non
ChIJMyGOdAMpdTER6x7S6lP54Rs,ME SCHOOL Hoàng Văn Thụ - Trường Mầm Non Quận Phú Nhuận,"198 Đ. Hoàng Văn Thụ, Phường 9, Phú Nhuận, Thành phố Hồ Chí Minh 70000, Vietnam",10.8006421,106.6745315,trường mầm non
ChIJ89E23SoldTERj4w85nqsVVE,Kids World 3 - Trường mầm non quận 7 - mầm non song ngữ quận 7,"Land P, 4 Số 1, KDC City, Quận 7, Thành phố Hồ Chí Minh 700000, Vietnam",10.7361418,106.7261737,trường mầm non
ChIJjwSoOrQvdTERFPmxacaHa1s,Trường Mầm Non Quốc Tế Global Ecokids,"200 Đ. 3 Tháng 2, Phường 12, Quận 10, Thành phố Hồ Chí Minh 72500, Vietnam",10.7749442,106.6783714,trường mầm non
ChIJQfTCRhMldTERKj5nVjQJHU0,ME SCHOOL Tân Thuận - Trường Mầm Non Quận 7,"110 Đường Nguyễn Văn Linh, Tân Thuận Tây, Quận 7, Thành phố Hồ Chí Minh 700000, Vietnam",10.7527427,106.7255005,trường mầm non
ChIJg0nkQ3svdTER5MM8pv4rG5I,Trường Mầm Non Việt Mỹ - VA Schools Mầm Non Phú Định,"119 - 121 Đ.Tùng Thiện Vương, Phường Phú Định, Quận 8, Thành phố Hồ Chí Minh 751830, Vietnam",10.7481968,106.6650303,trường mầm non
ChIJexAaLf0ldTERuHjIt4P0s_c,Trường Mầm Non Mini Minds,"Riviera Point, Chung cư, 2 Nguyễn Văn Tưởng, Tân Phú, Quận 7, Thành phố Hồ Chí Minh 760000, Vietnam",10.7319376,106.7292109,trường mầm non
ChIJrVudGjsvdTERNWSF27rjhqM,Trường Mầm Non Hải Yến - Since 1999,"6 Bà Huyện Thanh Quan, Phường 6, Quận 3, Thành phố Hồ Chí Minh, Vietnam",10.77542,106.690196,trường mầm non
ChIJC79oV_0udTERGwCsppTrym0,Trường Mầm Non 3 - Cơ sở 1,"152 Đ. Huỳnh Mẫn Đạt, Phường 2, Quận 5, Thành phố Hồ Chí Minh, Vietnam",10.7572574,106.6761016,trường mầm non
ChIJMUIWzt8vdTERDGVvtokvRbY,Mầm Non Yêu Con Nít Steiner,"62 Số 23, Tân Quy, Quận 7, Thành phố Hồ Chí Minh 700000, Vietnam",10.743958,106.7098383,trường mầm non
ChIJH8-He6codTER2p8Q5Zssu48,KALEI Preschool - Mầm Non Lăng Kính Trẻ Thơ,"667/5 Điện Biên Phủ, Phường 25, Bình Thạnh, Thành phố Hồ Chí Minh 700000, Vietnam",10.7996008,106.7217999,trường mầm non
ChIJoVm_I5AvdTER1Vmaicn_aMI,KinderStar Preschool,"08 Đặng Đại Độ, Tân Phong, Quận 7, Thành phố Hồ Chí Minh 700000, Vietnam",10.7325242,106.7110665,trường mầm non
ChIJAzHYLdcodTER-WkfCuCH9b0,Smiling Fingers Montessori _ Trường mầm non song ngữ tốt nhất quận Phú Nhuận,"31 Đ. Đoàn Thị Điểm, Phường 1, Phú Nhuận, Thành phố Hồ Chí Minh 700000, Vietnam",10.7987216,106.6820995,trường mầm non
ChIJP_kWyvEudTERuV0M3ZU_BKs,Trường Mầm Non Họa Mi 2,"11 Đ. Lý Thường Kiệt, Phường 12, Quận 5, Thành phố Hồ Chí Minh, Vietnam",10.7573595,106.6612888,trường mầm non
ChIJ31WZ00QudTERwFrB7YspjsA,"Hệ thống trường mầm non Little Dragons - CS Bông Sao, Quận 8","Tầng M Chung Cư Bông Sao, Tạ Quang Bửu, P.5, Quận 8, Hồ Chí Minh, Thành phố Hồ Chí Minh 700000, Vietnam",10.7367118,106.6611048,trường mầm non
ChIJxyCFmyEvdTERn7eoVy69APs,Trường Mầm Non Măng Non 1,"702 Hẻm Lê Hồng Phong, Phường 12, Quận 10, Thành phố Hồ Chí Minh, Vietnam",10.7761097,106.6678358,trường mầm non
ChIJPdL-SDIpdTERr1poUQp0pZY,Bright Star Preschool,"71/15 Hẻm 71 Nguyễn Bặc, Phường 3, Tân Bình, Thành phố Hồ Chí Minh, Vietnam",10.7948647,106.6611446,trường mầm non
ChIJRVYiWM0odTERp1dOO04JIcs,ME SCHOOL Tân Định - Trường Mầm Non Quận 3,"Hẻm 13A Nguyễn Văn Mai, Phường Võ Thị Sáu, Quận 3, Thành phố Hồ Chí Minh 700000, Vietnam",10.7902011,106.6881867,trường mầm non
ChIJYZyUjRwvdTERGpOEIZagdv4,Hoa Mi 3 Kindergarten,"285 An Dương Vương, Phường 2, Quận 5, Thành phố Hồ Chí Minh 70000, Vietnam",10.7596421,106.6810287,trường mầm non
ChIJCdWSVTUvdTERDs8mWrCo7Uo,Be Ngoan Pre-School,"108 Nguyễn Đình Chiểu, Đa Kao, Quận 1, Thành phố Hồ Chí Minh, Vietnam",10.7864598,106.697336,trường mầm non
ChIJ5ZEG3tcudTERde_sOFhhr44,Trường Mầm Non Tư Thục Thiên Thanh,"300 Cách Mạng Tháng Tám, Phường 9, Quận 3, Thành phố Hồ Chí Minh 70599, Vietnam",10.7811116,106.6759105,trường mầm non
ChIJl-CU4CIvdTERWXigE0NA1H8,Trường Mầm Non Số 5,"416 Nguyễn Thị Minh Khai, Phường 5, Quận 3, Thành phố Hồ Chí Minh, Vietnam",10.7707893,106.6864943,trường mầm non
ChIJLzMoh_8udTERvebV760QoKw,Trường Mầm Non Vành Khuyên,"123 - 125 Đ. Hưng Phú, Phường Hưng Phú, Quận 8, Thành phố Hồ Chí Minh, Vietnam",10.7502363,106.6798913,trường mầm non
ChIJb9hefm0vdTERvApAk42Clnk,Trường Mầm Non Baby,"5-7 Đ.Số 9, Phường 4, Quận 4, Thành phố Hồ Chí Minh, Vietnam",10.7565262,106.7025538,trường mầm non
ChIJe57u4jMvdTERXNrN432n-wo,Trường Mầm Non Quốc Tế Global Kids,"39B Phạm Ngọc Thạch, Phường 6, Quận 3, Thành phố Hồ Chí Minh, Vietnam",10.7844091,106.6935061,trường mầm non
ChIJ1xO-AIovdTERUNqzTXmyUl8,Trường Mầm Non Chú Voi Con – JumboKiz Kiều Đàm,"793/55 Trần Xuân Soạn, Tân Hưng, Quận 7, Thành phố Hồ Chí Minh 70000, Vietnam",10.7476742,106.7003776,trường mầm non
ChIJXyuVcMsodTERxKDjhhbDizA,Trường Mầm Non Hoa Quỳnh,"34 Đ. Nguyễn Phi Khanh, Phường Tân Định, Quận 1, Thành phố Hồ Chí Minh, Vietnam",10.7918477,106.6947236,trường mầm non
ChIJ6Vg8rSsvdTERSf9bCRuMtms,Trường Mầm Non 14,"284/34b, 284 Đ. Lê Văn Sỹ, Phường 14, Quận 3, Thành phố Hồ Chí Minh 700000, Vietnam",10.7875365,106.6801178,trường mầm non
ChIJaciRDD0vdTERRdFnGPSeINc,Trường Mầm Non Tuổi Thơ,"137a Nguyễn Trãi, Phường Phạm Ngũ Lão, Quận 1, Thành phố Hồ Chí Minh, Vietnam",10.7693277,106.6906893,trường mầm non
ChIJh0kgMgMR2EERKlCDsht2w3E,Lớp Mầm Non Hoa Mặt Trời,"6 Đường Số 43, Tân Quy, Quận 7, Thành phố Hồ Chí Minh 70000, Vietnam",10.7430473,106.7177147,trường mầm non
ChIJB5VT1BYvdTERUzwE4-waa3k,TRƯỜNG MẦM NON CÔ GIANG,"50 Hồ Hảo Hớn, Phường Cô Giang, Quận 1, Thành phố Hồ Chí Minh, Vietnam",10.7619698,106.6919307,trường mầm non
ChIJh4fpps0odTERaTzQAsSDyq4,Trường mầm non Tân Định,"26 Đặng Dung, Phường Tân Định, Quận 1, Thành phố Hồ Chí Minh, Vietnam",10.7927879,106.6907394,trường mầm non
ChIJN9hmc6spdTERheZLtM8Y6fQ,Trường Mầm Non Quốc Tế SuperKids,"245/16 Đ. Hoàng Văn Thụ, Phường 1, Tân Bình, Thành phố Hồ Chí Minh, Vietnam",10.7994885,106.6667216,trường mầm non
ChIJd119m-QudTERZJlZRcICkAo,Trường Mầm non Ngôi Nhà Trí Tuệ,"93 Nguyễn Chí Thanh, Phường 9, Quận 5, Thành phố Hồ Chí Minh, Vietnam",10.7599431,106.6699918,trường mầm non
ChIJG2VNHrYvdTER7PLT8w1B5Ow,Trường Mầm non 5 Quận 3,"6/117 Cao Thắng, Phường 5, Quận 3, Thành phố Hồ Chí Minh, Vietnam",10.7698552,106.6848011,trường mầm non
ChIJoaKR9GwvdTERN-al0r4zWS0,Trường mầm non Ngày Vui - Topaz City Block B1,"39 Cao Lỗ, Phường 4, Quận 8, Thành phố Hồ Chí Minh, Vietnam",10.7381777,106.679217,trường mầm non
ChIJWV1CC8wodTERqyE5tqJqSRc,Mầm non Bồ Câu nhỏ,"68/10C Trần Quang Khải, Phường Tân Định, Quận 1, Thành phố Hồ Chí Minh, Vietnam",10.7936796,106.6936669,trường mầm non
ChIJ5wh_wc0odTERViTK7a8LhoY,"Kinderland - Chuon Chuon Kim Preschool @ Tan Dinh, District 1","53/2 Trần Khánh Dư, Phường Tân Định, Quận 1, Thành phố Hồ Chí Minh, Vietnam",10.7940394,106.6897568,trường mầm non
ChIJDwHB0BcvdTERh1JV2CFy4zA,Trường Mầm Non Phạm Ngũ Lão,"230 Đ. Cống Quỳnh, Phường Phạm Ngũ Lão, Quận 1, Thành phố Hồ Chí Minh, Vietnam",10.7664673,106.6891008,trường mầm non
ChIJD_YROOc36EMRkZflrvKdyew,Trường mầm non Nụ cười hạnh Phúc - Happy Smile Kindergarten,"Nguyễn Tuyển, Phường Bình Trưng Tây, Thủ Đức, Thành phố Hồ Chí Minh 70000, Vietnam",10.7872218,106.7634071,trường mầm non
ChIJ_yZaSYcndTERXcx3O-KHAo0,Trường Mầm Non Song Ngữ Montessori Vườn Ươm Hạnh Phúc,"7 Đ. D2, Phường Phú Hữu, Thủ Đức, Thành phố Hồ Chí Minh, Vietnam",10.800877,106.7960589,trường mầm non
ChIJ9au4tisndTERn9cLe2_yTQA,Tiny House Montessori,"28 Đường số 816, Khu biệt thự, Thủ Đức, Thành phố Hồ Chí Minh 70000, Vietnam",10.78942,106.7935167,trường mầm non
ChIJEXFWjV4ldTER_eboopHNQwY,Victoria Preschool System HCMC - Trường Mầm Non,"29 Sử Hy Nhan, Phường Thạnh Mỹ Lợi, Thủ Đức, Thành phố Hồ Chí Minh, Vietnam",10.7661875,106.7590276,trường mầm non
ChIJs-ZS8dYndTER0jCi_2n3kio,Trường mầm non Moon Home (Moon Home Montessori Preschool),"Đ. 816/6 Nguyễn Duy Trinh, Phường Phú Hữu, Thủ Đức, Thành phố Hồ Chí Minh, Vietnam",10.7907112,106.7937956,trường mầm non
ChIJq7zGa3AndTERXzYJwN9hzY8,Trường mầm non Clover Montessori (Cỏ Ba Lá) - Cơ sở 1 - Lakeview city (An Phú - Quận 2 cũ),"KĐT Lake View City, Đ. Số 5/169-171 cũ, Quận 2, Thủ Đức, Thành phố Hồ Chí Minh 700000, Vietnam",10.7952335,106.7777172,trường mầm non
ChIJI_R3GDMndTERElIohA5Aqjg,Mầm Non Shiny Little Stars Montessori - Cơ sở Đỗ Xuân Hợp,"46 Đ. 268, Phước Long A, Thủ Đức, Thành phố Hồ Chí Minh 700000, Vietnam",10.8232572,106.7683332,trường mầm non
ChIJ39aZ9MEhdTERtS7Yb_lbN1o,Seroto School,"28 Đ. Trường Lưu, Long Trường, Thủ Đức, Thành phố Hồ Chí Minh 700000, Vietnam",10.8035859,106.8217594,trường mầm non
ChIJIRNabr0ndTERLgKqU6GOlI0,ME SCHOOL Thảo Điền - Trường Mầm Non Quận 2,"30A Trần Ngọc Diện, Thảo Điền, Quận 2, Thành phố Hồ Chí Minh 71100, Vietnam",10.8052612,106.7404345,trường mầm non
ChIJWzXjjlkndTER4gMvXreoV6U,Mầm non Happy House Montessori,"19 Đ.D6, Khu dân cư Hưng Phú, Thủ Đức, Thành phố Hồ Chí Minh, Vietnam",10.8102379,106.7881881,trường mầm non
ChIJUQX9XS8ldTERmfV7sq6WIVs,Trường Mầm non NewGen,"24 Lê Văn Thịnh, Phường Bình Trưng Tây, Thủ Đức, Thành phố Hồ Chí Minh 10000, Vietnam",10.7872139,106.7690701,trường mầm non
ChIJWR3Wcu4mdTERM0gO-G812oY,"Mầm Non Pathway School - Cơ sở Fuji Nam Long, Tp. Thủ Đức","1 Đ. D13, Khu Phố 6, Thủ Đức, Thành phố Hồ Chí Minh, Vietnam",10.812919,106.784538,trường mầm non
ChIJtdLnMAAndTERA_zlStRNIvs,MẦM NON CÔ VÀ BÉ,"753 Nguyễn Duy Trinh, P. Phú Hữu, TP Thủ Đức, Thành Phố, Thủ Đức, Thành phố Hồ Chí Minh 700000, Vietnam",10.7905538,106.7829284,trường mầm non
ChIJW4uwPJcldTERg1nYZlSZwy0,Trường Mầm Non Quốc Tế Artemis (AIP) - Quận 2,"4 Bát Nàn, Quận 2, Thủ Đức, Thành phố Hồ Chí Minh 27100, Vietnam",10.781701,106.7539469,trường mầm non
ChIJo4AMLt8ndTERHl8oWgHgvwQ,Trường Mầm non Jolio,"69A Dương Đình Hội, Quận 9, Thủ Đức, Thành phố Hồ Chí Minh, Vietnam",10.8187528,106.7768052,trường mầm non
ChIJEz-wCfMldTER6WdWqMn-fcQ,Trường Mầm Non Bong Bóng nhỏ,"149 Đ. 38 - CL, Cát Lái, Thủ Đức, Thành phố Hồ Chí Minh, Vietnam",10.7704542,106.7891185,trường mầm non
ChIJ9RyFZOAndTERgaPMiNUzMss,Trường mầm non Sakura Schools Nguyễn Địa Lô - Cát Lái - TP. Hồ Chí Minh,"33-49 Nguyễn Địa Lô, Phường Thạnh Mỹ Lợi, Thủ Đức, Thành phố Hồ Chí Minh 71106, Vietnam",10.7733166,106.7603722,trường mầm non
ChIJ0__dzy0ldTEReIJKb2ahX8o,Trường Mầm Non Quốc Tế Global Ecokids - The CBD,"125 Đ. Đồng Văn Cống, P, Thủ Đức, Thành phố Hồ Chí Minh 700000, Vietnam",10.7741304,106.7622869,trường mầm non
ChIJ314mLwAndTERzVLXG_9tGf4,Mầm non Niềm Tin Việt cs Đỗ Xuân Hợp - Beliefs Kindergarten,"679/7 Đ. Đỗ Xuân Hợp, Phước Long B, Thủ Đức, Thành phố Hồ Chí Minh 700000, Vietnam",10.7985109,106.7809961,trường mầm non
ChIJk8Dsxn8ndTER_Goc8yMLJII,Trường mầm non Song ngữ Kidzone - Cơ sở Nguyễn Duy Trinh,"Hẻm 401 Nguyễn Duy Trinh, Bình Trưng Đông, Quận 2, Thành phố Hồ Chí Minh 700000, Vietnam",10.7900018,106.7682006,trường mầm non
ChIJ24sJa78mdTERPKrVbblsxPA,Trường Mầm Non Con Mèo Vàng,"299 Liên Phường, Phường Phú Hữu, Thủ Đức, Thành phố Hồ Chí Minh 700000, Vietnam",10.8057053,106.7962772,trường mầm non
ChIJK0WLfb0odTERfuMrYDS6JdM,Lớp Mẫu Giáo Tư Thục Ánh Sáng,"20 Đinh Bộ Lĩnh, Phường 14, Bình Thạnh, Thành phố Hồ Chí Minh 700000, Vietnam",10.8049094,106.7097602,trường mầm non
ChIJ7zDaC10ldTERUid3yXnp24E,WonderKids Montessori School,"4-6 Đường số 20, Phú Mỹ, Quận 7, Thành phố Hồ Chí Minh 700000, Vietnam",10.720455,106.732371,trường mầm non
ChIJ_____yoqdTER9NCOi4CHLY4,Trường Mầm non Sơn Ca - Phân hiệu,"74/3 KHU PHỐ 7, PHƯỜNG ĐÔNG HƯNG THUẬNQUẬN 12, Đông Hưng Thuận, Quận 12, Thành phố Hồ Chí Minh, Vietnam",10.8385933,106.6185227,trường mầm non
ChIJPX7vl9YpdTERkmaiLXns5NE,Trường Mầm non Hugo House,"Số 1 D. So 6, Khu Đô Thị Vạn Phúc P, Thủ Đức, Thành phố Hồ Chí Minh 71314, Vietnam",10.8428957,106.712551,trường mầm non
ChIJ8anuhv4rdTERlw_tlGH4v-s,Trường Mầm Non Tư Thục Minh Tuyết,"15 Cầu Xéo, Tân Quý, Tân Phú, Thành phố Hồ Chí Minh, Vietnam",10.7985778,106.6262179,trường mầm non
ChIJQ6BR8D4ydTERBpW5p4pOr9k,Trường Mầm Non Họa Mi,"336 An Phú Tây - Hưng Long, An Phú Tây, Bình Chánh, Thành phố Hồ Chí Minh, Vietnam",10.6818929,106.6094395,trường mầm non
ChIJ-3k1VUYzdTERitrkr835W1A,Trường Mầm Non Ngôi Sao Tương Lai,"Đường số 1A, khu dân cư, Ấp 2, Bình Chánh, Vietnam",10.6804404,106.6156249,trường mầm non
ChIJuSxDnEo7dTERbex2PIvpfmk,Lớp Mầm Non Hoàng Đạo - HDKids,"488 Đ. Nguyễn Văn Tạo, Ấp 23, Nhà Bè, Thành phố Hồ Chí Minh 07000, Vietnam",10.6450614,106.7318156,trường mầm non
ChIJ-etdJZs7dTER65x0yAlCoUQ,Trường mầm non Thái Hoàng Gia,"202 Đ. Nguyễn Văn Tạo, Long Thới, Nhà Bè, Thành phố Hồ Chí Minh 700000, Vietnam",10.6591997,106.7273483,trường mầm non
ChIJ7yOxRB4wdTERmxYbomPyucw,Preschool Phuc Long,"1288 Đ. Lê Văn Lương, Ấp 2, Nhà Bè, Thành phố Hồ Chí Minh, Vietnam",10.6979942,106.7034269,trường mầm non
ChIJ89ewAEMvdTERAfP04oq4Eus,Trường Mầm non Nam Sài gòn,"Lô P3 Khu A, Đô thị mới Nam, Tân Phú, Quận 7, Thành phố Hồ Chí Minh, Vietnam",10.7228853,106.7246341,trường mầm non
ChIJxxZ1BAAldTERCVlPM2TzZOw,Mầm Non Trẻ Sáng Tạo - Cơ Sở 6,"1363a Huỳnh Tấn Phát, Phú Mỹ, Quận 7, Thành phố Hồ Chí Minh, Vietnam",10.7159461,106.7370309,trường mầm non
ChIJfYJDgeoodTERWNM7qXiRYVM,Kindergarten 3 Candles Kids,"393 Chu Văn An, Phường 12, Bình Thạnh, Thành phố Hồ Chí Minh, Vietnam",10.811272,106.6973255,trường mầm non
ChIJN6_4rL0udTERLZDCNKW3fQQ,Trường Mầm Non Tư Thục Phú Bình,"27 Lạc Long Quân, Phường 5, Quận 11, Thành phố Hồ Chí Minh 700000, Vietnam",10.7728747,106.6443915,trường mầm non
ChIJe9qZ5qfHczER2hhdGvRhAHM,Trường Mầm Non Quốc Tế Kindy Garden KGIS- Cơ sở Ngân Long,"Khu Biệt Thự Ngân Long, Đ. Nguyễn Hữu Thọ, Phước Kiển, Nhà Bè, Thành phố Hồ Chí Minh, Vietnam",10.7191511,106.7023824,trường mầm non
ChIJmeMdOUsvdTERo0aUs6G2x9s,Nguyen Binh Khiem Primary School,"2Bis Nguyễn Bỉnh Khiêm, Bến Nghé, Quận 1, Thành phố Hồ Chí Minh, Vietnam",10.7882952,106.7040484,trường tiểu học
ChIJF8e23fAudTERjsO8e0rtpZg,Minh Dao Primary School,"15 Đ. Ký Hoà, Phường 11, Quận 5, Thành phố Hồ Chí Minh, Vietnam",10.7541763,106.6618823,trường tiểu học
ChIJo6uS8DcvdTER1ri2Kjqw038,Hoa Binh Primary School,"1 Công trường Công xã Paris, Bến Nghé, Quận 1, Thành phố Hồ Chí Minh, Vietnam",10.7788997,106.6989168,trường tiểu học
ChIJi6kLKSIvdTERfgDt9906xck,Luong Dinh Cua Primary School,"576 Nguyễn Đình Chiểu, Phường 4, Quận 3, Thành phố Hồ Chí Minh, Vietnam",10.7705835,106.6824497,trường tiểu học
ChIJhVEDdJYodTER_tsB74YhHHc,Chu Van An Primary School,"2 Số 3, Phường 26, Bình Thạnh, Thành phố Hồ Chí Minh, Vietnam",10.8126342,106.7061854,trường tiểu học
ChIJH9DJiT8vdTER4SyD0vF9VrY,Nguyen Thai Binh Primary School,"105 Nguyễn Thái Bình, Phường Nguyễn Thái Bình, Quận 1, Thành phố Hồ Chí Minh, Vietnam",10.768832,106.6994622,trường tiểu học
ChIJlSu12TYvdTER1xB_UeCDxrA,Tran Quoc Thao Primary School,"6 Võ Văn Tần, Phường 6, Quận 3, Thành phố Hồ Chí Minh, Vietnam",10.7818984,106.6950142,trường tiểu học
ChIJu-8h4dcudTER0KabiAwcyeQ,Nguyen Viet Hong Primary School,"292/ 9 Cách Mạng Tháng Tám, Phường 9, Quận 3, Thành phố Hồ Chí Minh, Vietnam",10.7811429,106.6762979,trường tiểu học
ChIJvRE--DwvdTERpVnpbFeX_N0,Nguyen Hue Primary School,"93-95a Lê Thị Riêng, P. Phú Thuận, Quận 1, Thành phố Hồ Chí Minh, Vietnam",10.7708531,106.69094,trường tiểu học
ChIJjaNMWdUudTERFntCrq2LYaM,Nguyễn Thi Primary School,"12 Đ. Lê Văn Sỹ, Phường 14, Quận 3, Thành phố Hồ Chí Minh, Vietnam",10.7894859,106.6762416,trường tiểu học
ChIJlYLx5PwudTERig0oQXfKhzg,Tran Quoc Toan Primary School,"292 Trần Phú, Phường 7, Quận 5, Thành phố Hồ Chí Minh 700000, Vietnam",10.7566034,106.6728996,trường tiểu học
ChIJd7PQuxAvdTER3Lw78YQaTfQ,Tran Hung Dao Primary School,"81 Trần Đình Xu, Phường Nguyễn Cư Trinh, Quận 1, Thành phố Hồ Chí Minh, Vietnam",10.7615144,106.6890652,trường tiểu học
ChIJZbEqiy0vdTERQMmd15SmrxM,Nguyen Thanh Tuyen Primary School,"183 Nam Kỳ Khởi Nghĩa, Phường Võ Thị Sáu, Quận 3, Thành phố Hồ Chí Minh, Vietnam",10.7858179,106.6879545,trường tiểu học
ChIJrTkSvTIvdTER5qrrMW4MbBY,Nguyen Thai Son Primary School,"12 Huỳnh Tịnh Của, Phường Võ Thị Sáu, Quận 3, Thành phố Hồ Chí Minh, Vietnam",10.7888345,106.6880969,trường tiểu học
ChIJX0JHoNYudTERBf61l7A6BcM,Tran Van Dang Primary School,"39/15 Đ. Đỗ Thị Lời, Phường 11, Quận 3, Thành phố Hồ Chí Minh, Vietnam",10.7862607,106.6721348,trường tiểu học
ChIJzRvyzMoodTERhadWiz7QPdk,Dinh Tien Hoang Primary School,"67 Đinh Tiên Hoàng, Đa Kao, Quận 1, Thành phố Hồ Chí Minh, Vietnam",10.7895846,106.698074,trường tiểu học
ChIJn0a3DBMvdTERPK91e7dHqJ4,Dang Tran Con Primary School,"203 Bến Vân Đồn, Phường 2, Quận 4, Thành phố Hồ Chí Minh, Vietnam",10.7608133,106.6973979,trường tiểu học
ChIJb29nKjQvdTERXfaj0D26REU,Me Linh Primary School,"159 Hai Bà Trưng, Phường 6, Quận 3, Thành phố Hồ Chí Minh 700000, Vietnam",10.7839129,106.6965581,trường tiểu học
ChIJrWQnFWsvdTERxSLhMz0PSKU,Nguyen Van Troi Primary School,"02 Đ. Vĩnh Khánh, Phường 9, Quận 4, Thành phố Hồ Chí Minh, Vietnam",10.7633907,106.7016388,trường tiểu học
ChIJaejvAxQvdTERqDfbo-TY-8A,Luong The Vinh Primary School,"116 Cô Giang, Phường Cô Giang, Quận 1, Thành phố Hồ Chí Minh, Vietnam",10.7628565,106.6942331,trường tiểu học
ChIJCxRgdEAvdTERzlXcOBOGBjA,Khai Minh Primary School,"44 Phó Đức Chính, Phường Nguyễn Thái Bình, Quận 1, Thành phố Hồ Chí Minh, Vietnam",10.7690641,106.7002653,trường tiểu học
