place_id,name,address,lat,lng,type
ChIJt615QgMldTERES0QxTOrsqM,Sala Park,"512/12 Trần Não, An Lợi Đông, Quận 2, Thành phố Hồ Chí Minh, Vietnam",10.770365,106.725919,công viên
ChIJ____TtkudTERWju8PCocG2A,Lake Park Ky Hoa,"Công viên Hồ Kỳ Hoà, Cao Thắng, Phường 12, Quận 10, Thành phố Hồ Chí Minh, Vietnam",10.7746609,106.671473,công viên
ChIJzxWUSVQpdTERPw9iHI2pu60,Công viên Nguyễn Thế Truyện,"Nguyễn Thế Truyện, Tân Sơn Nhì, Tân Phú, Thành phố Hồ Chí Minh, Vietnam",10.7968567,106.6325203,công viên
ChIJ54x9ES4vdTER7tJw0M5y0MA,Công viên Vườn Lài,"53 Đ. Vườn Lài, Phú Thọ Hoà, Tân Phú, Thành phố Hồ Chí Minh, Vietnam",10.7872809,106.6341845,công viên
ChIJXSFg6WIudTERsrQ6ce-aGJY,Parks Bai Say,"303 Đ. Bình Tiên, Phường 8, Quận 6, Thành phố Hồ Chí Minh, Vietnam",10.7469979,106.6421792,công viên
ChIJ_77zljQvdTERiYXBfIgn-vU,Công Viên Trung Tâm,"6 Lương Định Của, Thủ Thiêm, Quận 2, Thành phố Hồ Chí Minh, Vietnam",10.7760437,106.7103,công viên
ChIJB39sjw4ndTER1F2t8b0W20o,Park District 9,"Hồ Thị Tư, Hiệp Phú, Thủ Đức, Thành phố Hồ Chí Minh, Vietnam",10.8434476,106.7787246,công viên
ChIJp-v5fw0qCzERizMLuq0oSZw,7 Wonders Park,"VFX6+VHF, Mỹ Hạnh Bắc, Đức Hòa, Long An, Vietnam",10.9004266,106.4616251,công viên
ChIJW-Wdq3kudTERixpbqNJYYyY,Công Viên Bình Phú,"20U Đ. Cư Xá P. Lâm D, Phường 10, Quận 6, Thành phố Hồ Chí Minh, Vietnam",10.7417608,106.6327796,công viên
ChIJl__MIgAndTERAbkLwFJ9BWE,Bach Dang Quay Park,"10B Tôn Đức Thắng, Bến Nghé, Quận 1, Thành phố Hồ Chí Minh, Vietnam",10.7731999,106.7067289,công viên
ChIJAwJpXSkvdTERELFnDrgLv0M,Bach Tung Diep Park,"QMGX+HP3, Bến Nghé, Quận 1, Thành phố Hồ Chí Minh, Vietnam",10.7763855,106.6992953,công viên
ChIJPe2OYW0vdTERADxj2FV3I8Y,Khanh Hoi Park,"Đ. Số 48/229 Đ. Vĩnh Hội, Phường, Quận 4, Thành phố Hồ Chí Minh, Vietnam",10.7572321,106.6985583,công viên
ChIJbWpYi6YudTERoVydMO67ugE,A St Park,"QJHM+GCX, Hòa Thạnh, Tân Phú, Thành phố Hồ Chí Minh, Vietnam",10.77886,106.6336042,công viên
ChIJBWLf5zEhdTER3I35WDCl3aI,Công viên thể dục Vinhomes Grand Park,"RRVV+4X, Long Bình, Thủ Đức, Thành phố Hồ Chí Minh, Vietnam",10.8428445,106.8449826,công viên
ChIJDVVE218ndTERMH5tiruKQNQ,CÔNG VIÊN HOA HỒNG NGỌC,"RRV2+CG5, Tăng Nhơn Phú A, Thủ Đức, Thành phố Hồ Chí Minh, Vietnam",10.8435201,106.8013683,công viên
ChIJ7YcaiwcndTERmnCPV62gWyQ,Công viên Thanh Niên,"45 Số 494, Tăng Nhơn Phú A, Thủ Đức, Thành phố Hồ Chí Minh, Vietnam",10.8428089,106.8005153,công viên
ChIJE3KjclsndTER5xlpMbl04A4,Công Viên Khu Công Nghệ Cao Quận 9,"Long Thạnh Mỹ, Thủ Đức City, Ho Chi Minh City, Vietnam",10.8434353,106.8063698,công viên
ChIJr7d0EzwhdTER2_dnEQCJD4Q,Vinhomes Grand Park Light Park,"RRQR+HPR, Đ. T2, Long Bình, Thủ Đức, Thành phố Hồ Chí Minh, Vietnam",10.8405406,106.844397,công viên
ChIJhyVFkaZrCzERDBC6_pP8kTo,Công Viên Hoa Anh Đào – Sakura Park Phú Mỹ Hưng,"Số 1 Đ. Số 15, Phú Thuận, Quận 7, Thành phố Hồ Chí Minh, Vietnam",10.7244038,106.7273089,công viên
ChIJR1a79nktdTERjSFLCTQPaTY,Công viên cây xanh và khu vui chơi dành cho trẻ em,"PH7Q+G94, Tân Kiên, Bình Chánh, Thành phố Hồ Chí Minh, Vietnam",10.7137586,106.5884585,công viên
ChIJnQZkPAAvdTERs4xtSBEl4sc,Saigon Riverfront Park,"59 Thủ Thiêm, Thủ Đức, Thành phố Hồ Chí Minh, Vietnam",10.7716904,106.7098014,công viên
ChIJp57AUgAvdTER_L5F7Pr4l0U,Quảng Trường Thủ Thiêm,"QPG6+HQ9, Thủ Thiêm, Quận 1, Thành phố Hồ Chí Minh, Vietnam",10.7764185,106.7119968,công viên
ChIJa38QR6c7dTERaFI_U3_y5m4,Saigon Wonderland Park,"PPH6+XH7, Đặng Đại Độ, Khu đô thị Phú Mỹ Hưng, Quận 7, Thành phố Hồ Chí Minh, Vietnam",10.7299156,106.7114151,công viên
ChIJGW5njOIvdTEREqQBA6XrdMI,Công viên Bến Nhà Rồng,"1 Đ. Nguyễn Tất Thành, Phường 12, Quận 4, Thành phố Hồ Chí Minh, Vietnam",10.7683534,106.7062075,công viên
ChIJxYBYlDYvdTERcHp0Pp7buJI,Turtle Pond,"Công trường Quốc Tế, Phường 6, Quận 3, Thành phố Hồ Chí Minh, Vietnam",10.7826071,106.695926,công viên
ChIJmVLhRQAvdTERqF8AEKPIb9s,Công viên Hòa Bình,"QM6F+794, Nguyễn Chí Thanh, Phường 2, Quận 10, Thành phố Hồ Chí Minh, Vietnam",10.7606465,106.6734434,công viên
ChIJA9vl96AvdTERTaWBfwMVyUw,Parks - Lake Ecology - Himlam.,"Tân Hưng, District 7, Ho Chi Minh City, Vietnam",10.7437923,106.6968903,công viên
ChIJE4CpdoYldTERV9wY01fEVAQ,Tan Thuan Park,"QP3H+7JC, Tân Thuận Đông, Quận 7, Thành phố Hồ Chí Minh, Vietnam",10.7531793,106.7290157,công viên
ChIJxwCjo0MpdTERXpdm1yRpKR8,The Diamond Park Van Phuc City,"Đường 18, Khu đô Thị Vạn Phúc, Thủ Đức, Thành phố Hồ Chí Minh, Vietnam",10.8456608,106.7047555,công viên
ChIJXybPBgAvdTERRF87J8Y7Xq4,Creative Park,"33 10 Lương Định Của, Thủ Thiêm, Thủ Đức, Thành phố Hồ Chí Minh, Vietnam",10.780052,106.712611,công viên
ChIJS8zOuTQvdTERPWhsGWY_tzc,Công viên Cầu Rạch Ông,"561/20A Đ. Trần Xuân Soạn, Tân Hưng, Quận 7, Thành phố Hồ Chí Minh, Vietnam",10.751736,106.692357,công viên
ChIJvyzpou8udTER5BjJpSOkv1U,Thong Nhat Stadium,"138 Đ. Đào Duy Từ, Phường 6, Quận 10, Thành phố Hồ Chí Minh, Vietnam",10.760687,106.6632718,sân vận động
ChIJga4frscudTERc_-J6yvvUP8,Phu Tho Stadium,"221 Đ. Lý Thường Kiệt, Phường 9, Quận 11, Thành phố Hồ Chí Minh, Vietnam",10.7676438,106.6559222,sân vận động
ChIJx6YjBscpdTERlrJ806lpemA,Gia Dinh Stadium,"2A Phan Chu Trinh, Phường 12, Bình Thạnh, Thành phố Hồ Chí Minh, Vietnam",10.8145899,106.7024723,sân vận động
ChIJz0OOpr0vdTERrYFEd4OJMaM,Ton Duc Thang University Outdoor Stadium,"Sân bóng đá, Đường D6, Tân Hưng, Quận 7, Thành phố Hồ Chí Minh, Vietnam",10.7326143,106.6977375,sân vận động
ChIJwVyEOGUldTERITtNUE939T8,Sân vận động quận 7,"PP6R+V3R, Hoàng Quốc Việt, Phú Mỹ, Quận 7, Thành phố Hồ Chí Minh, Vietnam",10.7122369,106.7401436,sân vận động
ChIJE0aVQakpdTERDxOOnhDUprY,Dat Duc Stadium,"5A Đ. Nguyễn Văn Lượng, Phường 16, Gò Vấp, Thành phố Hồ Chí Minh 700000, Vietnam",10.8387682,106.6683576,sân vận động
ChIJVVUlji8pdTERhPIHwqSsTf0,Military Zone 7 Stadium,"2A Đ. Phan Đình Giót, Phường 2, Tân Bình, Thành phố Hồ Chí Minh, Vietnam",10.801867,106.6673668,sân vận động
ChIJYQH4A1EudTERGzNL1yizMms,Stadium of District 8,"302 Đ. Phạm Hùng, Phường 5, Quận 8, Thành phố Hồ Chí Minh, Vietnam",10.7395954,106.6675965,sân vận động
ChIJ46PFnjYvdTERaOdS8jFruGs,Sân vận động Đầm Sen,"45 Đ. Hòa Bình, Phú Trung, Tân Phú, Thành phố Hồ Chí Minh, Vietnam",10.7698058,106.6373063,sân vận động
ChIJVZdeR18vdTER6T7A-7HWfbU,Sala Dai Quang Minh Stadium,"17 Đ. Hoàng Thế Thiện, An Lợi Đông, Thủ Đức, Thành phố Hồ Chí Minh 700000, Vietnam",10.7710326,106.7218764,sân vận động
ChIJF1n2_iTddDERvHBaJyQVl30,Dong Nai Stadium,"Tân Hiệp, Bien Hoa, Dong Nai, Vietnam",10.9616352,106.862804,sân vận động
ChIJm5DtejkvdTERIsG8l9bQ6ic,Sân banh Tao Đàn,"Huyền Trân Công Chúa, Phường Bến Thành, Quận 1, Thành phố Hồ Chí Minh 700000, Vietnam",10.7752661,106.694804,sân vận động
ChIJ11_kCu8jdTERYsHtxwweO98,Sân vận động Sài Gòn Đô,"Quách Thùy Trang, Phú Thạnh, Nhơn Trạch, Đồng Nai, Vietnam",10.7084387,106.8499949,sân vận động
ChIJ_ZUmHvHYdDERg4sy1bYq24A,Di An Stadium,"Đông Hoà, Dĩ An, Binh Duong, Vietnam",10.9020492,106.7788146,sân vận động
ChIJDdfHdyApdTERE1hfGEIK9S0,Phu Nhuan Football Club,"03 Hoàng Minh Giám, Phường 9, Phú Nhuận, Thành phố Hồ Chí Minh 00008, Vietnam",10.8105795,106.6759295,sân vận động
ChIJj1UWnjkpdTERlZTVHd3BM7o,TBG Arena - Artificial Football Field 5 & 7 people,"407/19 Đ. Nguyễn Xí, Phường 13, Bình Thạnh, Thành phố Hồ Chí Minh 700000, Vietnam",10.8227603,106.6993272,sân vận động
ChIJhfL82nzVdDERqERPOpIk2C0,Sân Vận Động Tân Hiệp,"WH4P+9HG, Tân Hiệp, Hóc Môn, Thành phố Hồ Chí Minh, Vietnam",10.905934,106.5864637,sân vận động
ChIJ7x65je8udTER7_UFVlVjZm8,Sân Đá Banh Mini Thống Nhất,"138 Đ. Đào Duy Từ, Phường 6, Quận 10, Thành phố Hồ Chí Minh, Vietnam",10.7599711,106.664052,sân vận động
ChIJPesNbhLYdDERGii5FxH9sUA,4 corps stadium,"Dĩ An, Bình Dương, Vietnam",10.8849518,106.7427777,sân vận động
ChIJOaxTM_4odTERfpDrzvI4VbY,Stadiums 152,"152 Nguyễn Oanh, Phường 1, Gò Vấp, Thành phố Hồ Chí Minh, Vietnam",10.8334476,106.6763608,sân vận động
ChIJFcvIAXopdTER4__T_K2xjNY,Svd Gò Vấp,"RJJR+4F5, Phường 12, Gò Vấp, Thành phố Hồ Chí Minh, Vietnam",10.8302602,106.6412353,sân vận động
ChIJ_UasLdQndTERei5lHr3L7SA,Sân Vận Động Cá Sấu,"95 Đ. Sô 48, Hiệp Bình Chánh, Thủ Đức, Thành phố Hồ Chí Minh, Vietnam",10.8356702,106.7261188,sân vận động
ChIJa-3Jh8sndTERrzFLtXaiEAk,Sân bóng 11 người Bình Quới,"435/11 Bình Quới, Phường 28, Bình Thạnh, Thành phố Hồ Chí Minh, Vietnam",10.833769,106.741314,sân vận động
ChIJWY5r08EyCzERG7ZtovKQWRI,Sân Vận Động An Nhơn Tây,"3GP6+QCW, Tỉnh Lộ 7, An Nhơn Tây, Củ Chi, Thành phố Hồ Chí Minh, Vietnam",11.0869938,106.5110752,sân vận động
ChIJ6xq76l7RdDERw759fz8w_cc,Go Dau Stadium,"Đ. 30 Tháng 4, Phú Thọ, Thủ Dầu Một, Bình Dương, Vietnam",10.9700932,106.6719776,sân vận động
ChIJkXO7rPHVdDER2hcVSVPzrv8,Sân Bóng Đá Thới Tứ,"2/5A Trịnh Thị Miếng, Ấp Thới Tứ 1, Hóc Môn, Thành phố Hồ Chí Minh, Vietnam",10.8896875,106.6143125,sân vận động
ChIJT8HjudYpCzERzVAQtqo4fZM,Hau Nghia Stadium,"VCX2+26V, TT. Hậu Nghĩa, Đức Hòa, Long An, Vietnam",10.8976138,106.4005407,sân vận động
ChIJy6IjPCwtdTERBpAzWhUrvf8,Sân bóng đá Nguyễn Thị Định,"PJFC+9G3, Phường 16, Quận 8, Thành phố Hồ Chí Minh, Vietnam",10.723384,106.6213096,sân vận động
ChIJ_xB24OQrdTER_y30-cYWn34,Sân Bóng Đá Celadon,"Đ. Tân Thạnh, Sơn Kỳ, Tân Phú, Thành phố Hồ Chí Minh 700000, Vietnam",10.805615,106.6202293,sân vận động
ChIJ911hAYUndTERJNFs_eO-rSs,Sân Bóng Linh Trung,"1262 Đ. Kha Vạn Cân, Khu phố 2, Thủ Đức, Thành phố Hồ Chí Minh, Vietnam",10.8642109,106.7629621,sân vận động
ChIJfyg3CQ07dTERyP5L3_91MSM,Sân Vận Động Quốc Gia Một Sình,"243 Rừng Sác, Bình Khánh, Cần Giờ, Thành phố Hồ Chí Minh 73300, Vietnam",10.6581177,106.7808243,sân vận động
ChIJFwPaG6xioDERKGqARKULuJs,Can Tho Stadium,"Cái Khế, Ninh Kiều, Cần Thơ, Vietnam",10.0490362,105.7889836,sân vận động
ChIJU7jShGcpdTER7f6q7xhqXp0,Sân Bóng Đại Học Công Nghiệp Thức Phẩm,"Tây Thạnh, Tân Phú, Ho Chi Minh City, Vietnam",10.8091864,106.6300825,sân vận động
ChIJ1_6sKeoudTERto25faHCNlg,Trung tâm bóng đá Dương Minh Sài Gòn,"219 Đ. Lý Thường Kiệt, Phường 15, Quận 11, Thành phố Hồ Chí Minh 70000, Vietnam",10.767572,106.6583786,sân vận động
ChIJB5tp0zspdTERarJg-FmXD5Q,Chao Lua Football Field,"30 Đ. Phan Thúc Duyện, Phường 4, Tân Bình, Thành phố Hồ Chí Minh, Vietnam",10.8055081,106.6589605,sân vận động
ChIJTzoB0sEudTER1HNO37WE1hg,Sân bóng đá mini Phú Thọ,"F4 Đ. Lữ Gia, Phường 15, Quận 11, Thành phố Hồ Chí Minh, Vietnam",10.7704625,106.6560064,sân vận động
ChIJnf64LaMvdTERb-fIuc-qmic,Dai Hoc Canh Sat Nhan Dan Football Field,"36 Đ. Nguyễn Hữu Thọ, Tân Hưng, Quận 7, Thành phố Hồ Chí Minh 700000, Vietnam",10.7350151,106.6955013,sân vận động
ChIJNc6f9x4pdTERXLf34VRBOdw,K34 football Court,"Đ. Bạch Đằng, Phường 2, Tân Bình, Thành phố Hồ Chí Minh, Vietnam",10.8162798,106.6725685,sân vận động
ChIJafBSSygmdTER63W70OjeUgA,Ngoc Viet football pitch,"Đ. số 10, Hiệp Bình Chánh, Thủ Đức, Thành phố Hồ Chí Minh, Vietnam",10.8236142,106.7254685,sân vận động
ChIJtZ_a88nYdDERpBAKy7F2PxU,Sân Vận Động Cao đẳng Công nghệ cao Đồng An,"VRV6+5FF, Bình An, Dĩ An, Bình Dương, Vietnam",10.8929278,106.8111727,sân vận động
ChIJK7ozn4cpdTERyPmceaYOsWQ,Sân Bóng Đá Đại Nam WeSport,"38/40 Đông Hưng Thuận 11, Đông Hưng Thuận, Quận 12, Thành phố Hồ Chí Minh 700000, Vietnam",10.8450768,106.6297128,sân vận động
ChIJt0Z3DesudTERddarYC4Fzz4,Mini Soccer Field Thành Phát - xoivotv.today,"4 Đ. Lê Đại Hành, Phường 15, Quận 11, Thành phố Hồ Chí Minh, Vietnam",10.7669338,106.6547983,sân vận động
ChIJ52z9oCQfdTERwyp0epUQE-M,Long Thanh Stadium,"QWRX+HHP, Đ. Trường Chinh, Long Thành, Đồng Nai, Vietnam",10.7914721,106.9489573,sân vận động
ChIJxUSU2cUndTERTcbQakzumII,Ho Chi Minh City University of Technology Football Field,"1 Đ. Võ Văn Ngân, Linh Chiểu, Thủ Đức, Thành phố Hồ Chí Minh, Vietnam",10.8505572,106.7729939,sân vận động
ChIJNfPffD2hQTERx5yU6W4IeMc,Sân Vận Động Tự Do,"FH8X+W36, Nguyễn Thái Học, Phú Hội, Huế, Thành phố Huế, Vietnam",16.4672845,107.5976253,sân vận động
ChIJyysi9jsvdTERBDuTMOVSlVU,Nguyen Du Gymnasium,"116 Nguyễn Du, Phường Bến Thành, Quận 1, Thành phố Hồ Chí Minh 700000, Vietnam",10.7730465,106.6930759,sân vận động
ChIJAbiFyLEodTERQmPc5ozjR7I,Công Ty TNHH Thể Thao Quốc Phong,"Chung cư Mỹ Long, khu phố 3, Thành phố Hồ Chí Minh, Vietnam",10.8253315,106.7187239,sân vận động
ChIJq6qqr8EYdTERWzur1yJjdAs,Sân Vận Động Phước Thiền,"QW4R+G3X, 166 ĐT769, Phước Thiền, Nhơn Trạch, Đồng Nai, Vietnam",10.7563136,106.9393652,sân vận động
ChIJg4H3MfQndTERXxZLSqMt5Bs,Sân Bóng TDC,"83 Đường Số 22, Phước Long B, District 9, Thành phố Hồ Chí Minh, Vietnam",10.8281713,106.7796254,sân vận động
ChIJfwaqe40odTERwDTnGs1TbbM,Red Bridge Football Stadium,"516 Đ. Phạm Văn Đồng, Phường 13, Bình Thạnh, Thành phố Hồ Chí Minh 700000, Vietnam",10.8220526,106.7021531,sân vận động
ChIJX80Hm4MvCzERRD350MTpSl8,Trang Bang Stadium,"29J3+CVP, Trảng Bàng, Tây Ninh, Vietnam",11.0310984,106.3547004,sân vận động
ChIJxSbxmsIudTERf3qBxCrps58,Trung Tâm Thể Dục Thể Thao Quận 10 - Nhà Thi Đấu Nguyễn Tri Phương,"5 Thành Thái, Phường 14, Quận 10, Thành phố Hồ Chí Minh, Vietnam",10.7698888,106.662421,sân vận động
ChIJM8MmtToqdTER8tyHPF1AHNs,Sân Bóng Đá Vì Nhân,"RJX8+JQ6, Trung Mỹ Tây, Quận 12, Thành phố Hồ Chí Minh, Vietnam",10.8490341,106.6168913,sân vận động
ChIJkw0KuOYvdTER8ZQiW3mJsFU,Phong Son Lam Sơn,"320/1 Đường Trần Bình Trọng, Phường 4, Quận 5, Thành phố Hồ Chí Minh, Vietnam",10.7623271,106.6798241,sân vận động
ChIJs1RkR4ElCzER_krfRzZjdMo,Sân vận động Trảng Bàng(mới),"28VW+63G, Lộc Trác, Trảng Bàng, Tây Ninh, Vietnam",11.0430697,106.3451979,sân vận động
ChIJPX9rHoAhdTERicqBFQe4W7E,Sân cỏ nhân tạo Khánh Anh,"72 Nguyễn Xiển, Trường Thạnh, Thủ Đức, Thành phố Hồ Chí Minh, Vietnam",10.8184588,106.8325698,sân vận động
ChIJVUVhAEEpdTERelvwWuO5seI,Sân Bóng Vạn Xuân,"RM54+X8, Phường 4, Tân Bình, Thành phố Hồ Chí Minh, Vietnam",10.80996,106.655807,sân vận động
ChIJDQR3HSovdTERT1t17jInrAo,Sân Bóng Đá Cầu Lông,"946 Trường Sa, Phường 12, Quận 3, Thành phố Hồ Chí Minh, Vietnam",10.78515,106.677618,sân vận động
ChIJH10K_yEtdTERMbdZrYUShzg,Sân Bóng Đá Lê Vương Bình Chánh - Sân banh cỏ nhân tạo Lê Vương,"A1/9 ấp 1 Đường Hoàng Phan Thái, Bình Chánh, Thành phố Hồ Chí Minh, Vietnam",10.673837,106.5573891,sân vận động
ChIJf0ftHU8rdTERoygNo5WaqZg,Sân Bóng Điện Lực,"Trung My Tay, District 12, Ho Chi Minh City, Vietnam",10.856392,106.6209899,sân vận động
ChIJIVf5uQLRdDERa1e1FyybuVI,Sân Vận Động Thị Xã Thủ Dầu Một,"86 Huỳnh Văn Lũy, Phú Lợi, Thủ Dầu Một, Bình Dương, Vietnam",10.9993174,106.6754239,sân vận động
ChIJZ68CmvavCjERhfvP4J1503U,Stadium of Tien Giang Province,"1 Phan Lương Trực, Phường 6, Mỹ Tho, Tiền Giang, Vietnam",10.3572701,106.3502307,sân vận động
ChIJCctrER0pdTERRfSapa_M5SY,Sân Tân Sơn,"RMF3+QHF, Phường 15, Tân Bình, Thành phố Hồ Chí Minh, Vietnam",10.824434,106.6539193,sân vận động
ChIJNRSxcbYMdTERwqHojBehxJ4,Bà Rịa ( Football Stadium ),"Số 308 27 Tháng 4, Phước Hưng, Bà Rịa, Bà Rịa - Vũng Tàu 90000, Vietnam",10.50824,107.174221,sân vận động
ChIJVyBQFJgndTER2Lnew1W9nGo,Thu Duc Sport Center,"26 Chương Dương, Linh Chiểu, Thủ Đức, Thành phố Hồ Chí Minh, Vietnam",10.8526288,106.7602885,sân vận động
ChIJ-9VxSwApdTERPFxQ815csho,Sân vận động Quân khu 7 - Cổng Phổ Quang,"26 Đ. Phổ Quang, Phường 2, Tân Bình, Thành phố Hồ Chí Minh 700000, Vietnam",10.8022292,106.6659329,sân vận động
ChIJbXq5smDZdDERqW_MU9zhEks,Saigon Stars stadium,"VRF7+VM8, Long Bình, Thủ Đức, Thành phố Hồ Chí Minh, Vietnam",10.8746557,106.8141987,sân vận động
ChIJq_Br6LjZdDERZBL-uhHPQXc,Sân Banh Biên Hoà,"79 Huỳnh Văn Lũy, Quang Vinh, Biên Hòa, Đồng Nai, Vietnam",10.9493774,106.8126407,sân vận động
ChIJdRcuGAApdTERzGVDVcoJL9Q,"Sân bóng đá, bóng rổ, bóng chuyền CĐ Lý Tự Trọng","390 Đ. Hoàng Văn Thụ, Phường 4, Tân Bình, Thành phố Hồ Chí Minh 72106, Vietnam",10.797729,106.656127,sân vận động
ChIJZX3BUQ8sdTERtGchriw_r-8,Sân bóng Cầu Trắng,"30 Kênh Nước Đen, Bình Hưng Hoà A, Bình Tân, Thành phố Hồ Chí Minh 700000, Vietnam",10.7879627,106.6155237,sân vận động
ChIJt253bbDYdDERZvJvVFw5Gwo,Nhà học TDTT Đại Học Bách Khoa,"VRJ4+QC4, Đông Hoà, Dĩ An, Bình Dương, Vietnam",10.8818906,106.8060786,sân vận động
ChIJv68-FVEudTER-CbHFosp-uM,Center of Sports District 8,"6 Dương Quang Đông, Phường 5, Quận 8, Thành phố Hồ Chí Minh 700000, Vietnam",10.7392832,106.6659515,sân vận động
ChIJWfzV76UudTER5DWhBB7V9cE,Trung Tâm Văn Hóa - Thể Dục Thể Thao Quận Tân Phú,"502 Đ. Lũy Bán Bích, Phú Thọ Hoà, Tân Phú, Thành phố Hồ Chí Minh, Vietnam",10.7820111,106.6358724,sân vận động
ChIJEXdwFnjVdDERVbqLTMOOFsg,SÂN VẬN ĐỘNG CÂY DA,"Tân Phú Trung, Củ Chi, Ho Chi Minh City, Vietnam",10.9596933,106.5437154,sân vận động
ChIJI9BqXsfUdDER4i61xLg36F0,Sân Bóng Đá Trình Văn,"94 Nguyễn Thị Lắng, Tân Phú Trung, Củ Chi, Thành phố Hồ Chí Minh, Vietnam",10.9498141,106.55119,sân vận động
ChIJx5sl828rCzERCoLLG1QO-CA,Sân Vận Động Củ Chi,"XG72+743, Tân Thông Hội, Củ Chi, Thành phố Hồ Chí Minh, Vietnam",10.9631298,106.5002815,sân vận động
ChIJaZBEiVfVdDERr8t6HtxvRT0,Sân Vận Động Tân Phú Trung,"255 Nguyễn Thị Lắng, Tân Phú Trung, Củ Chi, Thành phố Hồ Chí Minh, Vietnam",10.959532,106.544216,sân vận động
ChIJD9E7_nsrCzERaN57UO3e1XM,Sân Bóng Đá Mi Ni Thanh Phong,"36 Nguyễn Giao, TT. Củ Chi, Củ Chi, Thành phố Hồ Chí Minh, Vietnam",10.96942,106.4936219,sân vận động
ChIJZ48L0nRVNDERjDBlBhcZQLM,Sân vận động Quốc gia Mỹ Đình,"1 Đ. Lê Đức Thọ, Mỹ Đình, Nam Từ Liêm, Hà Nội, Vietnam",21.0204835,105.7639194,sân vận động
ChIJW1Q04BUpdTERSuwqnbFtS2c,Sân bóng đá VOV,"RJWH+W8J, Đông Hưng Thuận, Quận 12, Thành phố Hồ Chí Minh, Vietnam",10.8473541,106.6283259,sân vận động
ChIJe5JRrSW2CjERtLJDfQR8g3Q,Long An Stadium,"44B Trương Định, Phường 2, Tân An, Long An, Vietnam",10.5360409,106.4082235,sân vận động
ChIJ9R6rcohSdTERWqzm-sPeD1A,Stadium Go Cong Tay District,"8HXJ+P57, TT. Vĩnh Bình, Gò Công Tây, Tiền Giang, Vietnam",10.3492968,106.5804214,sân vận động
ChIJOUbKrlwTcTERJmachg2gSN8,Lam Dong Stadium,"XC5J+PWH, Hẻm Xô Viết Nghệ Tĩnh, Phường 7, Đà Lạt, Lâm Đồng, Vietnam",11.9593069,108.4323747,sân vận động
ChIJu0tBWPTVdDERnv7H2_QQBj8,SANG TRỌNG ARENA,"368 Đường Lê Thị Lơ, Tân Hiệp, Hóc Môn, Thành phố Hồ Chí Minh, Vietnam",10.9058162,106.5873063,sân vận động
ChIJSSy9TQDVdDERQvMNXRXF-HU,Sân Vận Động Thới Tứ,"159/5h Đ. Tam Đông, 2, Hóc Môn, Thành phố Hồ Chí Minh, Vietnam",10.8897468,106.6147801,sân vận động
ChIJ7-S4hZkndTER9rWrs-FEi60,Sân bóng Trường Đại học Ngân hàng TP. HCM,"1060/11, Đ. Kha Vạn Cân, Linh Chiểu, Thủ Đức, Thành phố Hồ Chí Minh 700000, Vietnam",10.8562409,106.7589696,sân vận động
ChIJ3RgxoIfYdDERE8fEUCiq2-E,Sân banh Linh Xuân,"49/10 QL1A, Linh Xuân, Thủ Đức, Thành phố Hồ Chí Minh, Vietnam",10.8804351,106.7727598,sân vận động
ChIJ2ZwjE_YpdTERkkA1NhgAZb0,Military Zone 7 Stadium,"202 Đ. Hoàng Văn Thụ, Phường 9, Phú Nhuận, Thành phố Hồ Chí Minh, Vietnam",10.8008743,106.6688994,sân vận động
ChIJMxKs8uoudTERxWWJK8aqLlM,Golf 1 - Phu Tho football pitch,"2 Đ. Lê Đại Hành, Phường 15, Quận 11, Thành phố Hồ Chí Minh, Vietnam",10.7684756,106.6549472,sân vận động
ChIJfVXuJzwtdTER-jD-k-KMufc,Sân bóng Đồng Tâm,"275 Lê Tấn Bê, An Lạc, Bình Tân, Thành phố Hồ Chí Minh 70000, Vietnam",10.7130435,106.6049266,sân vận động
ChIJ0aaXyDssdTERb9Hufc-C5mc,Binh Tan Artificial Grass Yard Clusters,"QJ77+V32, Bình Trị Đông, Bình Tân, Thành phố Hồ Chí Minh, Vietnam",10.7646353,106.6126553,sân vận động
ChIJUfZam8IudTERirVO2hJvgrM,Nguyen Tri Phuong Stadium,"14 Ward, Phường 14, Quận 10, Thành phố Hồ Chí Minh, Vietnam",10.7699846,106.6622971,sân vận động
ChIJZbQ57T8vdTERp1SThIZU60U,Sân bóng Quốc Hưng ARENA,"Phạm Hùng Hẻm C4, Đường Phạm Hùng, Quận 8, Gần Khu Trung Sơn, Bình Chánh, Thành phố Hồ Chí Minh 739500, Vietnam",10.7289439,106.6725948,sân vận động
ChIJK8A9ujovdTERZyp4xgjsFPY,Fit 24 Ho Xuan Huong Sports Club,"2 Hồ Xuân Hương, Phường 6, Quận 3, Thành phố Hồ Chí Minh, Vietnam",10.7774225,106.6876029,sân vận động
ChIJPQyzVicpdTERZ_cVC9jTOfY,Sân Đá Banh Mini Quyền,"21 Đ. Đào Duy Anh, Phường 9, Phú Nhuận, Thành phố Hồ Chí Minh, Vietnam",10.8055451,106.6758356,sân vận động
ChIJz6DZLvwmdTERpSiCiG-hL1k,Tien Minh Soccer Pitch,"Khu tiểu đoàn 41, Hẻm 141 Đ. 339, Phước Long B, Thủ Đức, Thành phố Hồ Chí Minh, Vietnam",10.825187,106.7771948,sân vận động
ChIJu0H1-kgrdTER9zM7yoBWqhc,Sân bóng Thanh Thiện,"16 Đường D16, Tây Thạnh, Tân Phú, Thành phố Hồ Chí Minh, Vietnam",10.8140996,106.6269547,sân vận động
ChIJxdeszb0vdTERrS9HJv1XeBA,HCMC Cultural Palace for Labors,"55B Nguyễn Thị Minh Khai, Phường Bến Thành, Quận 1, Thành phố Hồ Chí Minh, Vietnam",10.7764832,106.692958,sân vận động
ChIJ--kWgxcsdTERW-UteSuqg2c,Sân Bóng Đá Hải Long 4,"334 Tân Hòa Đông, Bình Trị Đông, Bình Tân, Thành phố Hồ Chí Minh, Vietnam",10.7647529,106.6196376,sân vận động
ChIJB2iWGtwudTERZ7KNpFpooTw,Sân Bóng đá Tiểu Ngư,"780/14e Sư Vạn Hạnh, Phường 12, Quận 10, Thành phố Hồ Chí Minh, Vietnam",10.7741779,106.6703107,sân vận động
ChIJfWrMqEAvdTERkQ1grBC8_BQ,Sân bóng bàn cung văn hóa lao động,"QMGV+759, Phường Bến Thành, Quận 1, Thành phố Hồ Chí Minh, Vietnam",10.7756042,106.6929361,sân vận động
ChIJk0-aUMgndTERDtR_XJ9NKqs,Sân Banh Gò Dưa,"Hẻm 54 Đường 36, Linh Đông, Thủ Đức, Thành phố Hồ Chí Minh 800000, Vietnam",10.8392429,106.7441482,sân vận động
ChIJG4ZEAuKtCjERP65rUTyK-_I,Sân Vận Động Chợ Gạo,"8FXF+RJF Sân vận động, TT. Chợ Gao, Chợ Gạo, Tiền Giang, Vietnam",10.3495479,106.474044,sân vận động
ChIJWZdB1ERpdTERwpUdpzjx52g,Sân vận động,"CX44+X77, TT. Cần Thạnh, Cần Giờ, Thành phố Hồ Chí Minh, Vietnam",10.4074074,106.9556581,sân vận động
ChIJn_6CMc4ldTERfau3dKJESPI,Snow Town Saigon Playground,"Toà nhà The CBD Premium Home, 125 Đ. Đồng Văn Cống, Phường Thạnh Mỹ Lợi, Thủ Đức, Thành phố Hồ Chí Minh 700000, Vietnam",10.7737495,106.7627439,khu vui chơi
ChIJhzBJSmIpdTERA7hnOiLkQrY,Khu Vui Chơi Thiếu Nhi Thanh Đa,"RP98+F7Q, Đ. Thanh Đa, Cư xá Thanh Đa, Bình Thạnh, Thành phố Hồ Chí Minh, Vietnam",10.8187007,106.7157211,khu vui chơi
ChIJvc3x3lQndTERopoyicKQGdQ,DONNA Kidsplay Cafe | Khu vui chơi quanh đây | Khu vui chơi trẻ em quận 8 | Quán cafe có khu vui chơi cho bé,"908 Đ. Tạ Quang Bửu, Phường 5, Quận 8, Thành phố Hồ Chí Minh 700000, Vietnam",10.7344327,106.6601456,khu vui chơi
ChIJh9iH6totdTERmDrkIQQ7WiM,Khu vui chơi thiếu nhi,"244 Chiến Lược, Bình Trị Đông, Bình Tân, Thành phố Hồ Chí Minh, Vietnam",10.7617124,106.611769,khu vui chơi
ChIJA0FSQqEvdTERuUNes8gZ6-I,Vietopia,"98 Đ. Nguyễn Thị Thập, Tân Hưng, Quận 7, Thành phố Hồ Chí Minh 700000, Vietnam",10.7415542,106.6950039,khu vui chơi
ChIJrT8yBQApdTERqxrCJG2LoRo,Khu Vui Chơi Trẻ Em Happy Kids,"205 Phan Huy Ích, Phường 14, Thành phố Hồ Chí Minh, Vietnam",10.8335361,106.6343773,khu vui chơi
